{
  "$ref": "#/definitions/courses",
  "definitions": {
    "courses": {
      "type": "object",
      "properties": {
        "title": {
          "type": "string"
        },
        "badge": {
          "type": "string"
        },
        "isFeatured": {
          "type": "boolean",
          "default": false
        },
        "description": {
          "type": "string"
        },
        "format": {
          "type": "string"
        },
        "duration": {
          "type": "string"
        },
        "price": {
          "type": "string"
        },
        "link": {
          "type": "string"
        },
        "$schema": {
          "type": "string"
        }
      },
      "required": [
        "title",
        "description"
      ],
      "additionalProperties": false
    }
  },
  "$schema": "http://json-schema.org/draft-07/schema#"
}