{
  "title": "Фандрайзинг с нуля до гранта",
  "badge": "Флагман",
  "isFeatured": true,
  "description": "Полная система поиска и привлечения финансирования — от психологии доноров до выигрышной заявки.",
  "format": "Онлайн",
  "duration": "6 модулей",
  "price": "от $120",
  "link": "https://connect4funds.tilda.ws/"
}
